{
  "barcode": "09300695008826",
  "productName": "Enchilada Kit",
  "brand": "Old El Paso,General Mills",
  "genericName": "",
  "additives": [
    "e1422",
    "e202",
    "e282",
    "e297",
    "e330",
    "e422",
    "e450",
    "e450i",
    "e471",
    "e500",
    "e500ii",
    "e575"
  ],
  "allergens": [
    "gluten"
  ],
  "ingredients": [
    "corn",
    "cereal",
    "wheat-tortilla",
    "bread",
    "tortilla",
    "cooking-sauce",
    "wheat-flour",
    "flour",
    "wheat",
    "cereal-flour",
    "water",
    "humectant",
    "vegetable-oil",
    "oil-and-fat",
    "vegetable-oil-and-fat",
    "wheat-gluten",
    "gluten",
    "dextrose",
    "added-sugar",
    "monosaccharide",
    "glucose",
    "raising-agent",
    "acid",
    "emulsifier-mono-and-diglycerides-of-fatty-acids",
    "salt",
    "preservative",
    "turmeric",
    "condiment",
    "spice",
    "tomato-concentrate",
    "vegetable",
    "fruit-vegetable",
    "tomato",
    "bell-pepper",
    "onion",
    "root-vegetable",
    "onion-family-vegetable",
    "sugar",
    "disaccharide",
    "modified-corn-starch",
    "starch",
    "corn-starch",
    "modified-starch",
    "cumin",
    "seed",
    "garlic",
    "clove",
    "black-pepper-extract",
    "pepper",
    "black-pepper",
    "e422",
    "e450i",
    "e450",
    "e500ii",
    "e500",
    "e297",
    "citiric-acid",
    "e575",
    "e282",
    "e202",
    "1422",
    "e330"
  ],
  "ingredientsText": "Corn and Wheat Tortillas (42%) [Wheat flour (43%), water, ground corn (13%), humectant (glycerin), vegetable oil, wheat gluten, dextrose, raising agents (sodium acid pyrophosphate, sodium bicarbonate), food acids (fumaric acid, citiric acid, glucono delta-lactone), emulsifier mono and di-glycerides of fatty acids), salt, preservatives (calcium propionate, potassium sorbate), turmeric.]\r\nCooking Sauce (58%) [Water, tomato paste (14%), capsicum, onion, sugar, modified maize starch (1422), salt, cumin, garlic, cloves, food acid (citric acid), black pepper extract.]",
  "category": "meal-kits",
  "categories": [
    "meal-kits"
  ],
  "labels": [],
  "nutrientLevels": {
    "saturated-fat": "low",
    "sugars": "low",
    "fat": "low",
    "salt": "moderate"
  },
  "nutriments": {
    "salt_serving": 0.84,
    "energy-kcal_unit": "kcal",
    "carbohydrates_unit": "g",
    "carbohydrates_serving": 15.4,
    "energy_100g": 589,
    "sugars_unit": "g",
    "salt_100g": 1.29,
    "fat_100g": 2.92,
    "sugars_serving": 2.4,
    "sodium_100g": 0.517,
    "carbohydrates_100g": 23.7,
    "nova-group": 4,
    "sodium_unit": "g",
    "proteins_serving": 2.6,
    "energy_serving": 383,
    "energy-kcal_serving": 91.5391969263,
    "energy_unit": "kcal",
    "fat_serving": 1.9,
    "sodium_serving": 0.336,
    "sugars_100g": 3.69,
    "saturated-fat_unit": "g",
    "proteins_100g": 4,
    "saturated-fat_serving": 0.2,
    "energy-kcal_100g": 141,
    "salt_unit": "g",
    "saturated-fat_100g": 0.308,
    "proteins_unit": "g",
    "fat_unit": "g"
  },
  "nutriments_normalized": {
    "energy_kj": 589.0,
    "energy_kcal": 140.774,
    "fat_g": 2.92,
    "saturated_fat_g": 0.308,
    "carbohydrates_g": 23.7,
    "sugars_g": 3.69,
    "proteins_g": 4.0,
    "salt_g": 1.29,
    "sodium_mg": 517.0,
    "fiber_g": null
  },
  "nutriscoreGrade": "c",
  "productQuantity": 520.0,
  "productQuantityUnit": "g",
  "servingQuantity": 65.0,
  "servingQuantityUnit": "g",
  "traces": "",
  "completeness": 0.775,
  "images": {
    "root": "https://images.openfoodfacts.org/images/products/930/069/500/8826",
    "primary": "front_en",
    "variants": {
      "nutrition_en": 5,
      "front_en": 3
    }
  },
  "tags": {
    "final": [],
    "removed": []
  },
  "metadata": {
    "source": "local-enriched"
  }
}